{
  "$schema": "http://json-schema.org/draft-07/schema#",
  "title": "IQ-ME crisis-resources locale file",
  "description": "Story 6.5 AC-8 — schema-stable contract across Epic 6 (EN) and Epic 7 (RU + PL).",
  "type": "object",
  "required": ["locale", "lastUpdated", "resources"],
  "properties": {
    "_doc": { "type": "string" },
    "locale": { "type": "string", "enum": ["en", "ru", "pl"] },
    "lastUpdated": { "type": "string", "pattern": "^\\d{4}-\\d{2}-\\d{2}$" },
    "resources": {
      "type": "array",
      "minItems": 3,
      "items": {
        "type": "object",
        "required": ["name", "description", "url", "lastVerified"],
        "properties": {
          "name": { "type": "string", "minLength": 1 },
          "description": { "type": "string", "minLength": 1 },
          "url": { "type": "string", "pattern": "^(https?:|tel:)" },
          "lastVerified": { "type": "string", "pattern": "^\\d{4}-\\d{2}-\\d{2}$" }
        }
      }
    }
  }
}
